{
  "$schema": "https://json-schema.org/draft/2020-12/schema",
  "$id": "https://raw.githubusercontent.com/IACBI/agent-black-box/main/schema/agentblackbox.schema.json",
  "title": "Agent Black Box Configuration",
  "type": "object",
  "additionalProperties": false,
  "properties": {
    "$schema": {
      "type": "string",
      "description": "Optional JSON Schema reference for editor validation."
    },
    "configVersion": {
      "type": "integer",
      "const": 1,
      "description": "Agent Black Box config format version."
    },
    "sessionDir": {
      "type": "string",
      "minLength": 1,
      "description": "Directory where session reports are written. Paths must remain inside the repository by default; a trusted local external path requires the CLI override. Network and UNC paths are never allowed."
    },
    "exclude": {
      "type": "array",
      "items": {
        "type": "string",
        "minLength": 1
      },
      "uniqueItems": true,
      "description": "Repository-relative paths or path segments ignored by watching and reporting."
    },
    "riskPatterns": {
      "type": "array",
      "items": {
        "type": "string",
        "minLength": 1
      },
      "uniqueItems": true,
      "description": "Repository-relative paths or path segments treated as review-sensitive."
    },
    "maxFileSizeKb": {
      "type": "integer",
      "minimum": 1,
      "maximum": 102400,
      "description": "Maximum changed file size scanned for possible secret-like values."
    },
    "analysisPolicies": {
      "type": "object",
      "maxProperties": 32,
      "propertyNames": {
        "pattern": "^[a-z][a-z0-9-]{0,63}$",
        "not": { "enum": ["new-secrets", "complete-review"] }
      },
      "additionalProperties": {
        "type": "object",
        "additionalProperties": false,
        "properties": {
          "failOnNewSecrets": { "type": "boolean", "default": true },
          "requireCompleteCoverage": { "type": "boolean", "default": false },
          "minSeverity": { "enum": ["low", "medium", "high"] },
          "categories": {
            "type": "array",
            "minItems": 1,
            "maxItems": 32,
            "items": { "type": "string", "minLength": 1, "maxLength": 128, "pattern": "\\S" }
          }
        },
        "dependentRequired": { "categories": ["minSeverity"] }
      },
      "description": "Optional named staged CI policies, explicitly selected with --policy. Secret and coverage gates are independent of severity/category filters. Built-in policies cannot be replaced."
    },
    "secretPatterns": {
      "type": "array",
      "maxItems": 32,
      "items": {
        "type": "object",
        "additionalProperties": false,
        "required": ["name", "pattern"],
        "properties": {
          "name": { "type": "string", "minLength": 1, "maxLength": 80 },
          "pattern": { "type": "string", "minLength": 1, "maxLength": 256 },
          "ignoreCase": { "type": "boolean", "default": false }
        }
      },
      "description": "Additional JavaScript regular expressions that mark a single line as a possible secret. Patterns that match the empty string, use backreferences, or nest quantifiers such as (a+)+ are rejected. Only the first 4096 characters of a line are matched. Matches are also redacted from recorded commands."
    },
    "secretAllowlist": {
      "type": "array",
      "maxItems": 256,
      "items": {
        "type": "object",
        "additionalProperties": false,
        "required": ["reason"],
        "anyOf": [{ "required": ["path"] }, { "required": ["contains"] }],
        "properties": {
          "path": { "type": "string", "minLength": 1, "maxLength": 256 },
          "contains": { "type": "string", "minLength": 8, "maxLength": 256 },
          "reason": { "type": "string", "minLength": 1, "maxLength": 200 }
        }
      },
      "description": "Documented exceptions for possible-secret findings. An entry hides a finding when the file matches path (same matching as exclude) and the line contains the text, if given. Suppressed findings are counted in reports. Never put a real secret in contains."
    },
    "retention": {
      "type": "object",
      "additionalProperties": false,
      "properties": {
        "days": { "type": "integer", "minimum": 1, "maximum": 100000 },
        "keep": { "type": "integer", "minimum": 1, "maximum": 100000 },
        "archiveDir": { "type": "string", "minLength": 1 }
      },
      "description": "Optional defaults for session retention previews. Archiving still requires an explicit interactive apply."
    }
  },
  "required": ["configVersion", "sessionDir", "exclude", "riskPatterns", "maxFileSizeKb"]
}
