{
  "$schema": "https://raw.githubusercontent.com/IACBI/agent-black-box/main/schema/agentblackbox.schema.json",
  "configVersion": 1,
  "sessionDir": ".agent-black-box/sessions",
  "exclude": ["node_modules", ".git", "dist", "build", "coverage", ".next", ".agent-black-box"],
  "riskPatterns": [
    ".env",
    ".github/workflows",
    "Dockerfile",
    "docker-compose",
    "package.json",
    "pnpm-lock.yaml",
    "package-lock.json",
    "yarn.lock",
    "requirements.txt",
    "pyproject.toml",
    "Cargo.toml",
    "go.mod",
    "migrations",
    "auth",
    "security",
    "config"
  ],
  "maxFileSizeKb": 500
}
